RK,TIER,HOMIES,CODE,POS,POS,POS RK,TIER,PLAYER,PPL TEAM,SALARY,TAG,TEAM,BYE,NOTES,2022 PROJ,2021 TTL,BEST,WORST,AVG,BEST,WORST,AVG,STD DEV,BEST,WORST,AVG,STD DEV,ADP
223,,,RB65,RB,RB,65,12,Jerick McKinnon,FREE AGENT,NA,,KC,8,"Kansas City re-signed Jerick McKinnon to a one-year deal, adding him to a backfield alongside Clyde Edwards-Helaire, Ronald Jones and Derrick Gore. It'd be easy to brush off the McKinnon signing based on the mid-June timing, had he not fully taken over the backfield during KC's playoff run in 2021. In fact, from Week 18 through the first 3 rounds of the playoffs, McKinnon averaged 14.3 fantasy points (PPR) and over four receptions per game. When CEH returned from injury in the Divisonal Round, McKinnon doubled his touches (30 vs 15). With an established pass-catching background and obvious trust from the coaching staff to let him loose during the postseason, McKinnon should be considered with a late-round pick across all fantasy formats. As for Edwards-Helaire, it further creates doubt about his pass-catching role in the Chiefs offense. His 0.73 yards per route run ranked 64th out of 68 qualifying running backs in 2021. The mark was also significantly worse than his teammates Darrel Williams (1.28) and McKinnon (1.15).",67.76,22.9,59,88,70.7,177,321,239.1,,,,,,
224,,,QB29,QB,QB,29,12,Marcus Mariota,FREE AGENT,NA,,ATL,14,"The former No. 2 overall draft pick is being penciled in as The Falcons' Week 1 starter, though he'll have to fend off rookie Desmond Ridder. Mariota is a nimble runner, but his passing ability leaves his employers wanting more. Mariota turns 29 in October, so it's probably too late to dream of vast untapped upside.",240.53,14.9,22,32,27.8,178,305,231.6,2.5,24,35,28.6,2.7,
225,,,DST16,DST,DS,16,12,Pittsburgh Steelers,,,,PIT,9,0,,111,,,,164,302,231.9,8.4,59,116,81.5,12.7,
226,,,WR81,WR,WR,81,12,Zay Jones,,,,JAC,11,"Zay Jones played better down the stretch than second-year receiver Bryan Edwards, which earned him a three-year $30 million deal with the Jacksonville Jaguars. Jones averaged a 25% target share, 10.7 half-point fantasy points per game (27th) and 12.8 expected half-point fantasy points per game (18th) in the team's final five games including playoffs. He also led the team in total air yards (1,136). The former Raider is bound to be overlooked in fantasy despite a strong 2021 finish, so consider me a buyer in the very late rounds and in dynasty. Jones will be a starter on the outside and inherit the wide receiver role previously occupied by Laquon Treadwell. The former first-round pick finished the final six weeks of the fantasy season 10th in receiving yards with 381 - 64 per game. Jones, like Treadwell, also finished the last five weeks top-10 in PFF receiving grade versus man coverage - further bolstering Jones' case as a future playmaker on the boundary.",75.27,58.9,72,103,87,190,290,239.6,,,,,,
227,,,RB66,RB,RB,66,12,Samaje Perine,FREE AGENT,NA,,CIN,10,"Samaje Perine should still be considered the primary backup to Joe Mixon despite social media's obsession with Chris Evans. Perine has done nothing over the last two seasons to lose the role as he's been excellent when called upon. Since 2020 he's ranked fourth and 18th in yards after contact per attempt (minimum 50 carries, per PFF). Last year he also finished 31st in yards per route run among running backs (minimum 20 targets, per PFF). While Evans might arguably be the better passing down back, if Mixon were to go down, Perine would own the early down work with the upside to take all the action.",66.72,56.2,57,83,68.8,181,311,234.3,,,,,,
228,,,K9,K,K,9,12,Jason Sanders,HABANEROS,$1 ,X,MIA,11,Jason Sanders' massive drop-off from K1 to K20 is a reminder that you don't want to be caught chasing the No. 1 overall scorer from last season when it stands out like an outlier. Sanders' extremely high conversion rate on FGs of 50-plus yards in 2020 was a prime sign that regression would follow.,,115,8,17,12.2,213,288,235.5,3.9,24,32,27.9,1.6,
229,,,RB67,RB,RB,67,12,D'Ernest Johnson,FREE AGENT,NA,,CLE,9,"The Cleveland Browns tendered Johnson to prevent another team from adding him this offseason. He is certainly capable of being more than a third-stringer after an extremely impressive 2021 campaign that saw him finish as PFF's highest-graded rusher (90.6). Johnson also delivered in his three starts, averaging a whopping 22.6 fantasy points per game. He's a great player to target late with the hope that he finds more opportunity in 2022. Kareem Hunt's contract ends at the end of the 2022 season, so the Browns could move on from him a year early with a mid-year trade and elevate Johnson to the No. 2 on the depth chart.",27.3,85.1,54,84,67,170,322,229.1,9.6,51,92,69,9.7,
230,,,DST17,DST,DS,17,12,Philadelphia Eagles,,,,PHI,7,0,,111,,,,159,278,238.7,10.5,47,103,68.2,15.5,
231,,,K10,K,K,10,12,Rodrigo Blankenship,BROTHERHOOD,$1 ,X,IND,14,"2020's K6 was lost in 2021 due to an injury, but the combined efforts of Rodrigo Blankenship and Michael Bagley would have produce the K9 last season. Considering the Colts have ranked top-10 in FG attempts the past two seasons, Blankenship is an extremely safe option to return top-10 value.",,45,9,17,11.2,215,292,238.9,,,,,,
232,,,WR82,WR,WR,82,12,Curtis Samuel,FREE AGENT,NA,,WAS,14,"Curtis Samuel is coming off a lost season in which he dealt with groin and hamstring issues. Samuel could only gut out five games played and never saw more than 39% of snaps in any of them. Despite the team addressing the wide receiver depth chart with the selection of Jahan Dotson in the first round, Samuel still has a clear path to playing time as the starting slot wide receiver. Outside of health, the other looming question is how many receiving options can Carson Wentz support at this juncture. Samuel is a late-round dart throw only in redraft.",75.69,3.8,70,94,79.9,197,254,223.8,13.4,50,110,68.5,13.5,
233,,,RB68,RB,RB,68,12,Ronald Jones II,WAILERS,$1 ,X,KC,8,"The Kansas City Chiefs signed running back Ronald Jones to a one-year deal to help bolster their running back room behind Clyde Edwards-Helaire. The former Buccaneer took a major step backward in 2021, being regulated to strict backup duties after losing out on the starting gig in Tampa Bay to Leonard Fournette. And even when loaded to take on the bell-cow role with Fournette sidelined during the end of the season, RoJo failed to fire. He earned 20 carries in Week 16 versus the Panthers but totaled just 65 yards. The plodding runner also finished 51st out of 64 qualifying running backs in yards after contact per attempt (2.5). Jones is a one-dimensional grinder back, whose fantasy value will be super reliant on carry-volume, offensive line play, and overall offensive efficiency. That in itself means he will have fantasy appeal as a late-round running back in redraft if he can carve out a role on early-down and/or at the goal-line in a high-powered Chiefs offense.",43.3,69.2,40,90,68.6,119,359,236.3,,,,,,
234,,22,RB69,RB,RB,69,12,Eno Benjamin,HOMIES,$2 ,C,ARI,13,Eno Benjamin looks slated as the No. 2 complementary running back in the Cards backfield. He profiles more as the pass-catcher at 5-foot-9 and 207 pounds. Tough to see him earning the bellcow work over Darrel Williams if Conner goes down.,23.5,22,57,89,71.8,152,335,244.4,9.2,48,91,66.6,9.8,
235,,,TE28,TE,TE,28,12,Jonnu Smith,FREE AGENT,NA,,NE,10,"Jonnu Smith's talent didn't disappear overnight. Whether he struggled to pick up the playbook or the team shifted their preconceived notions on personnel usage in season, the fact remains that Smith didn't get the playing time that we projected entering 2021. Last season Smith still popped in per route metrics ranking eighth in yards per route run and first in YAC per reception (minimum 20 targets, per PFF). When he was on the field, the team did make it a point to get the ball in his hands as he led all tight ends in target per route run rate. Sadly, he eclipsed 60% of snaps played in only three games. If Smith can earn more snaps in 2022, there's still a ceiling to chase in the final rounds of your fantasy drafts.",60.88,39.4,24,34,28.9,180,290,244.5,9,55,90,78.8,9.2,
236,,,RB70,RB,RB,70,12,Zack Moss,HABANEROS,$1 ,X,BUF,7,0,40.71,82.2,58,81,69.9,181,315,238.2,,,,,,
237,,,K11,K,K,11,12,Nick Folk,PROGRAM,$1 ,C,NE,10,"2021 was the perfect storm for Nick Folk. He finished as the No. 1 fantasy kicker after finishing third in attempts and fifth in FG%. Folk connected on 90% of his fields goals for 30-plus yards. I'd be easy to brush off Folk's career year and point to regression in 2022, but the Patriots track record of reliable fantasy kickers suggests he can be a trusted commodity.",,171,8,17,11.2,204,298,239.1,6.2,64,107,83.3,8.8,
238,,,WR83,WR,WR,83,12,Sammy Watkins,FREE AGENT,NA,,GB,14,"Sammy Watkins' fantasy points per game over the last four seasons are as follows: 9.5, 8.0, 7.0 and 5.2. Not the direction you want to be going after joining his third team in three seasons. ESPN's Rob Demovsky said that based on the investment the Packers gave Watkins - $350,000 signing bonus as part of a one-year deal - he's hardly a lock to even make the Week 1 roster.",82.99,43.4,68,119,91.3,172,350,253.9,7.2,56,86,69.3,6.8,
239,,,WR84,WR,WR,84,12,A.J. Green,INVINCIBLES,$5 ,C,ARI,13,"A.J. Green was a shell of his former self last year, finishing as the WR42 in fantasy points per game. While his healthy return to the NFL was a heartwarming story, Green shouldn't be viewed as a difference maker at this point in his career. That doesn't mean he can't be a productive NFL player and a matchup-worthy play in a pinch. Green ranked 54th in yards per route run last year, immediately behind Laquon Treadwell, which is as nauseating as it sounds (minimum 50 targets, per PFF). While that looks ugly from a macro view, Green flashed his veteran savvy against zone coverage. He was 11th in yards per route run against zone last season, immediately ahead of Hunter Renfrow (minimum ten zone targets, per PFF). Temper your expectations for Green this year, but look to flex him against zone-heavy teams in 2022.",73.27,102.8,65,107,86.8,196,300,240.3,10.1,58,115,77.8,13.9,
240,,,WR85,WR,WR,85,12,Kendrick Bourne,FREE AGENT,NA,,NE,10,"Kendrick Bourne didn't absorb the same high-end target share that Jakobi Meyers did in the Patriots offense in 2021, but he posted career-high efficiency marks across the board. He caught 83% of his targets (2nd) and finished 14th overall in yards per route run (2.01). After such an impressive first season in New England, it wouldn't be outlandish to see Bourne earn more targets in Year 2. After all, his 70% route participation has room to grow.",102.66,125.5,67,121,86.3,175,306,234.3,,,,,,
241,,,K12,K,K,12,12,Robbie Gould,PROGRAM,$1 ,C,SF,9,"As good as Gold? Not so fast. Robbie Gould has finished outside the top-15 in FG% and total attempts the past 2 seasons, resulting in fantasy finishes beyond 20th. I'd be bearish on him as a reliable kicking option week-to-week. The 49ers top-10 red zone offense that past two seasons has not helped create more opportunities for Gould.",,112,9,26,13.1,212,292,242.8,7.4,72,105,86.9,8.8,
242,,,K13,K,K,13,12,Brandon McManus,DYNASTY,$1 ,X,DEN,9,"Despite Brandon McManus' big leg, he's only finished as top-10 fantasy K once. I'd stay away considering the projected success we will see from a Russell Wilson/Nathaniel Hackett red-zone combination in 2022.",,129,5,23,12.2,204,287,243.2,9,60,90,73.2,8.2,
243,,,DST18,DST,DS,18,12,Arizona Cardinals,,,,ARI,13,0,,126,,,,221,279,243.6,,,,,,
244,,,TE29,TE,TE,29,12,Cameron Brate,FREE AGENT,NA,,TB,11,"With Rob Gronkowski calling it a career, Cameron Brate likely steps into a snap rotation with Kyle Rudolph and Cade Otton. Last year Brate was tied for ninth in red-zone targets in the NFL. While he was 56th out of 58 tight ends in yards per route run last season, Brate has flashed far more efficient seasons in the past (minimum 20 targets, per PFF). In 2020 he was sixth in yards per route run at the position while also finishing 16th in back-to-back seasons in 2016-2017 (minimum 20 targets, per PFF). Last season his aDOT dropped to 7.8 as he was used primarily as a goal-line weapon, but he could see it climb back to the 10.0 range he enjoyed in 2016-2017. Brate is cheap exposure to one of the best offenses in the NFL.",59.82,48.5,26,43,31.1,164,346,251.1,,,,,,
245,,,WR86,WR,WR,86,12,Jamison Crowder,DYNASTY,$1 ,C,BUF,7,"If Jamison Crowder can just do what Cole Beasley did last season - 82 receptions for 693 yards, WR40 in PPR, WR48 in HPPR - he will vastly out-produce his ADP outside the top-60. Playing in a super pass-heavy offense will allow Crowder the opporuntity to soak up targets underneath, as he has done when healthy for the New York Jets. Just last year, the 29-year old commanded at least five targets in every single game he played without leaving due to injury. In those ten healthy games, the slot receiver averaged nearly five receptions and seven targets per game.",70.31,58.7,78,113,87.2,203,297,235.8,,,,,,
246,,,DST19,DST,DS,19,12,Cincinnati Bengals,,,,CIN,10,0,,108,,,,207,307,253.1,7.7,14,42,29.4,7.7,
247,,,RB71,RB,RB,71,12,Rex Burkhead,FREE AGENT,NA,,HOU,6,"The highest-paid running back on the Houston Texans roster is Rex Burkhead. $2.1 million of Burkhead's $2.35 million contract is fully guaranteed. Meanwhile, Marlon Mack signed a 1-year $2 million deal, and rookie Dameon Pierce was drafted in the fourth round. I envision Mack/Pierce duking out work on early downs, while Burkhead slides in as the primary pass-catching back after he ranked sixth in route participation over the last four weeks of the 2021 season. The receiving role is the one to target in this backfield for a team that projects to be playing from behind frequently. Not to mention that Burkhead came over from the New England Patriots last year alongside general manager Nick Caserio, so there's a built-in connection from management to the field. It's no coincidence that Burkhead nearly doubled his career highs in rushing attempts, rushing yards, and games started in his first year with Houston in 2021. And over the past two seasons, Burkhead has flashed a high weekly fantasy ceiling. He's crested 22-plus weekly fantasy points thrice since 2020. Mack has totaled 21.5 fantasy points over that span.",92.02,79.3,56,85,68.7,199,322,246.7,12.5,64,115,83.9,15.6,
248,,,K14,K,K,14,12,Younghoe Koo,INVINCIBLES,$1 ,X,ATL,14,"Younghoe Koo's top-12 ADP is based on his merits during an outstanding 2020 campaign, not necessarily based on his 2022 projection. Because based on the outlook of the Falcons offense — not great, 24th in RZ efficiency last season — we should be ranking/drafting him more like he was last season. He was the K18. Admittedly though, I'd expect Koo to regress positively closer to his 2020 form after finishing the season as PFF's second-highest graded kicker with the 5th best FG% (93%). Doesn't hurt either that he plays predominately in a dome.",,125,9,30,15.9,192,353,255.2,6.7,75,106,88.5,7.4,
249,,,WR87,WR,WR,87,12,David Bell,ROOKIE,NA,,CLE,9,"David Bell might be my favorite WR to draft from Day 3 of the real NFL draft. He has an awesome landing spot with the Cleveland Browns and quarterback Deshaun Watson . The Browns understand his limitations as an athlete, but his strengths as an underneath wide receiver can help him produce after the catch. Bell finished third in the FBS in receiving yards on the outside (1,097), second in total forced missed tackles (25) and 10th in PFF receiving grade (86.9) among his draft class. He's a perfect fit alongside prototypical No. 1 WR Amari Cooper and the speedy duo of Donovan Peoples-Jones/Anthony Schwartz.",74.48,0,63,106,83.8,160,304,233.1,,,,,,
250,,,WR88,WR,WR,88,12,Randall Cobb,HABANEROS,$3 ,C,GB,14,0,89.17,65.6,74,109,91.4,205,297,250,10.4,72,117,88.6,9.8,
251,,,RB72,RB,RB,72,12,Damien Williams,FREE AGENT,NA,,ATL,14,"Damien Williams was utilized sparingly last year in Chicago with only two games with 40% or higher snaps played. Williams looked like an aging running back on his last NFL legs when he was given touches. Last year he finished with 2.43 yards after contact per attempt, which is his lowest mark since 2016 (per PFF). Williams will likely steal some work in the Dirty Birds running back by committee approach, but expecting him to be a viable fantasy asset is a stretch at this juncture.",97.35,44.7,62,92,73.1,186,308,243.1,2.2,13,36,28.8,5.5,
252,,,RB73,RB,RB,73,12,Mike Davis,MACHINE,$3 ,X,BAL,10,0,31.71,94.2,55,79,68,145,363,243.3,6.8,74,118,89.5,8.8,
253,,,WR89,WR,WR,89,12,Sterling Shepard,HABANEROS,$6 ,X,NYG,9,"It might be time to give up our perennial hope for Sterling Shepard. Shepard is recovering from an Achilles rupture, and at age 29, he hasn't played a full 16 games since 2018. Stashing him as the final pick in drafts is fine because if he can recapture most of his 2021 effectiveness, there could be flex or best ball value to be had. Shepard was 21st in route win rate last season while also ranking first in win rate versus man coverage.",110.41,41.7,75,104,86.2,194,330,253.8,3.8,24,39,31.1,3.6,
254,,,K15,K,K,15,12,Jake Elliott,ROID RAGERS,$1 ,X,PHI,7,0,,150,8,20,15.2,224,306,254.9,18.9,51,101,73.1,9.7,
255,,,DST20,DST,DS,20,12,Tennessee Titans,,,,TEN,6,At home versus the turnover-prone Daniel Jones and New York Giants in Week 1.,,123,,,,225,307,255.1,12.4,73,114,94,10.4,
256,,,K16,K,K,16,12,Dustin Hopkins,INVINCIBLES,$1 ,X,LAC,8,"Dustin Hopkins is this year's Nick Folk: A Darkhorse to finish as fantasy's No. 1 kicker. It's probably more of a longshot with the Chargers' aggressiveness to go for it on fourth down, but hear me out. Hopkins was the K7 after joining LA in Week 8, going a perfect 7-7- on kicks between 40-49 yards while converting 90% of his kicks. And when he play indoors over that stretch, his points per game was just north of nine fantasy points per game.",,147,6,19,13.8,204,292,255.2,,,,,,
257,,,RB74,RB,RB,74,12,Trey Sermon,ROID RAGERS,$3 ,C,SF,9,"Shanahanigans are alive and well. After selecting Trey Sermon in the third round of the NFL Draft last year, the team chose to park him firmly on the bench. Sermon only saw work in three games last season, with his most extensive workload coming against the Seahawks (19 carries, 89 rushing yards). With the 49ers' heading back to the running back well with Tyrion Davis-Price this year in round three, Sermon could be parked on the pine or the inactive list all season. Unless we get positive reports from camp, he's not worth drafting outside of the final pick in any league.",24.6,25.3,63,106,79.9,183,321,239.4,12.5,52,107,73.9,13.2,
258,,,WR90,WR,WR,90,12,Byron Pringle,MACHINE,$1 ,C,CHI,14,0,56.81,84.8,85,104,92.6,210,298,257.1,7.9,82,106,93.6,6.7,
259,,,RB75,RB,RB,75,12,Chuba Hubbard,HABANEROS,$1 ,X,CAR,13,"Chuba Hubbard started with solid showings in his attempt to replace Christian McCaffrey's production last season after he was sidelined in Week 3. Hubbard averaged 20.4 touches and 83.4 total yards per game over the next five weeks as the RB36, RB16, RB22, RB29, and RB20. Hubbard's underlying metrics weren't so pretty as he finished the season 45th in juke rate and 41st in yards created per touch. By the end of the season, the team worked in multiple backs with Hubbard. Monitor camp reports for Hubbard's standing in this backfield in 2022, but I'm currently projecting D'Onta Foreman to be McCaffrey's primary backup.",63.73,112.6,60,87,73.8,192,364,264.3,,60,90,73.9,7,
260,,,QB30,QB,QB,30,12,Deshaun Watson,PROGRAM,$11 ,C,CLE,9,"Deshaun Watson is a top-five option when he gets back on the field after his six-game suspension. He was exactly that from 2019-2020, and there is no reason to think the 26-year-old won't pick up where he left off. During his last season of play, Watson led the NFL in passing yards and yards per attempt (8.9). Considering some best ball leagues are won in November/December, not September, he's worth stashing if you opt to wait on the quarterback position.",143.14,0,25,36,31.6,167,336,258.4,16.4,44,103,70.1,12.6,
261,,,RB76,RB,RB,76,12,Hassan Haskins,,,,TEN,6,"Michigan's Hassan Haskins was one of my favorite running back sleepers before the NFL Draft. I claimed I'd be in on him if he got Round 4 draft capital, and Haskins did exactly that being selected 131st overall. He broke out in a big way as “the guy” for the Wolverines in 2021, earning a 23 percent dominator rating, raising his career dominator rating to 20 percent. With an identical PFF rushing grade to Breece Hall (91.6) over the last three seasons, Haskins looked primed to exceed expectations in the NFL. He offers a lot of size at 6-foot-2 and 228 pounds, so he can handle a heavy workload. The Michigan product also led his entire class in rushing attempts inside the five-yard line (29), which gives him a real shot at carving out a goal-line role in the pros. Haskins will never see the field as long as Derrick Henry stays healthy. But there's zero doubt in my mind that he's the clear direct back-up for Henry, who showed us last season that he is mortal.",88.82,0,66,91,77.6,187,312,255.9,,,,,,
262,,,WR91,WR,WR,91,12,Laviska Shenault Jr.,ROID RAGERS,$1 ,C,JAC,11,"Laviska Shenault looks like the odd-man-out entering Year 3 with Christian Kirk, Marvin Jones and Zay Jones ahead of him in the target pecking order. Viska-stans might need a trade for him to revive his plummeting fantasy value. Because his team-leading 21% target rate per route run on 99 targets does suggest that maybe he's not as bad as the market perceives him. Especially considering the wide receivers going into Year 3 drafted in Round 2 that have eclipsed 170 targets since 2018 is a solid group to be associated with. Those names include JuJu Smith-Schuster, D.K. Metcalf, Tee Higgins, Chase Claypool, Courtland Sutton, A.J. Brown, Michael Pittman Jr. and Christian Kirk.",72.27,64,80,145,94.9,217,370,259.1,5.6,26,43,32.4,3.6,
263,,,TE30,TE,TE,30,12,C.J. Uzomah,BROTHERHOOD,$3 ,X,NYJ,10,"Last year C.J. Uzomah was the poor man's Zach Ertz as he volumed his way to fantasy relevance. He finished as the TE19 in fantasy points per game on the strength of ranking 11th in routes run and snap share. The Jets will use multiple tight end sets this year, rotating between him, Tyler Conklin, and more. Uzomah is nothing more than a streaming tight end option catching passes from Zach Wilson in 2022.",60.6,79.3,30,47,34.8,209,316,269.6,,,,,,
264,,,WR92,WR,WR,92,13,Terrace Marshall Jr.,FREE AGENT,NA,,CAR,13,"Terrace Marshall's outlook isn't rosy, with a pitiful 0.50 yards per route run in his rookie season and a foot injury that landed him on the IR (per PFF). The glass-half-full view of the situation is that the foot injury suppressed his effectiveness throughout the season. In a small sample, Marshall was snatching opposing corners' souls from their bodies in the preseason, securing 75% of his targets with 3.93 yards per route run (per PFF). The upside could be quite nice as a (nearly) free dice roll late. Robby Anderson looked like he was on his last legs in 2021. Marshall could supplant him as the Panthers' third option behind D.J. Moore and Christian McCaffrey.",26.43,15.8,83,177,97.9,209,361,258.6,7.8,77,107,90.8,8.7,
265,,,DST21,DST,DS,21,13,Minnesota Vikings,,,,MIN,7,0,,124,,,,219,330,279,8,78,116,94.1,8.9,
266,,,QB31,QB,QB,31,13,Mitch Trubisky,FREE AGENT,NA,,PIT,9,"After backing up Josh Allen in Buffalo last season, Trubisky will get a chance to start, this time with the Steelers. He'll have to beat out first-round rookie Kenny Pickett, however. Trubisky's 2018 season with the Bears raised hopes; his 2019 and 2020 seasons dashed them. Running ability and an NFL-caliber arm raise hopes that Trubisky's fantasy value can be rehabilitated.",,9.1,29,35,31.6,241,320,279.1,3.3,27,45,33.3,3.2,
267,,,RB77,RB,RB,77,13,Matt Breida,FREE AGENT,NA,,NYG,9,0,69.56,35.7,64,82,74.7,190,313,267.1,,,,,,
268,,,WR93,WR,WR,93,13,Nelson Agholor,ROID RAGERS,$1 ,C,NE,10,0,80.11,66.4,75,115,93.9,210,344,268.8,23.8,70,131,96.2,15.4,
269,,,DST22,DST,DS,22,13,Carolina Panthers,,,,CAR,13,0,,89,,,,234,318,270.1,6.6,66,94,77.3,6.1,
270,,,TE31,TE,TE,31,13,Adam Trautman,MACHINE,$1 ,X,NO,14,"Adam Trautman missed three games last season due to an MCL sprain, but his season was still a massive disappointment outside of the injury. His 1.05 yards per route run and 4.1 yards after the catch per reception won't get anyone excited for his 2022 prospects. Last year's depth chart was a perfect storm scenario for him to step forward if that was in the cards for his career arch. Sadly he only logged one top 12 tight end fantasy finish last year. The hope helium has been drained from his balloon. He's waiver wire fodder or a streaming option should injuries strike the Saints depth chart.",49.08,36.3,26,43,31.1,236,354,277.9,,,,,,
271,,,TE32,TE,TE,32,13,Dan Arnold,ROID RAGERS,$1 ,C,JAC,11,"Unlike Evan Engram in recent seasons, Dan Arnold has proven he can be an efficient NFL tight end. Arnold could overtake Engram as the Jaguars' top passing-catching tight end this season as the weeks roll on. In Weeks 5-11 last year, he played 62% or higher snaps in every game and was ninth in targets among tight ends (17% target share, 6.3 targets per game). In 2021 he was seventh in targets per snap and tenth in yards per route run immediately behind Darren Waller (minimum 20 targets, per PFF). While people worry about Engram or fawn over his athleticism, don't let Arnold's efficiency and own gym rat chops get lost in the mix. Arnold has a 98th percentile burst score (per Playerprofiler.com) and 93rd percentile agility.",37.04,40.8,28,48,35.8,246,350,279.7,,,,,,
272,,,RB78,RB,RB,78,13,Joshua Kelley,FREE AGENT,NA,,LAC,8,0,45.3,12,63,86,74.7,174,327,250.4,8.4,60,97,77.1,6.8,
