RK,TIER,HOMIES,CODE,POS,POS,POS RK,TIER,PLAYER,PPL TEAM,SALARY,TAG,TEAM,BYE,NOTES,2022 PROJ,2021 TTL,BEST,WORST,AVG,BEST,WORST,AVG,STD DEV,BEST,WORST,AVG,STD DEV,ADP
113,,,RB41,RB,RB,41,9,James Cook,ROOKIE,NA,,BUF,7,"Rookie running back James Cook has immediate sleeper fantasy appeal across all PPR formats based on his second-round draft capital, pass-catching prowess, explosiveness and offensive situation. The 5-foot-11, 199-pound running back has more than enough heft to manage a decent workload especially as a receiver out of the backfield. The 5-foot-7, 203-pound Devin Singletary was the RB3 over the last six weeks of the regular season when the Bills entrenched him as the featured guy. Cook with an ECR of RB44 seems priced closer to their floor than his ceiling considering Round 2 running backs have finished as top-36 running backs more than half the time (55%) since 2013.",104.83,0,36,47,41.4,89,143,117,4.6,33,54,41.5,5.8,
114,,,TE12,TE,TE,12,9,Pat Freiermuth,WAILERS,$6 ,C,PIT,9,"No rookie tight end flew up the dynasty rankings more than Pat Freiermuth, who made his case as a fringe fantasy TE1 in Year 1. The Pittsburgh Steelers rookie ramped things up in Week 6 after an injury to Eric Ebron and never looked back. Baby Gronk was the TE7 from that time forward, averaging 11.3 fantasy points per game seventh). He would go on to finish the year as the TE13 overall despite running a route on just 56% of dropbacks. When starting and healthy, Freiermuth ran a route on 67% of dropbacks - a rate that would have ranked 15th-highest at the position in 2021. That's the bare minimum usage fantasy drafters should expect to see from the Penn State product with Ebron gone in free agency.",93.62,91.7,10,17,12.8,94,136,117.2,4.2,25,46,40.4,4.5,
115,,,TE13,TE,TE,13,9,Hunter Henry,INVINCIBLES,$6 ,C,NE,10,"Hunter Henry emerged as Mac Jones' No. 1 red-zone weapon in his first year with the New England Patriots, finishing second in end-zone targets (13) and tying for first in red-zone touchdowns (9) with Mark Andrews. But Henry's dependency on scoring touchdowns for fantasy made his production extremely volatile with just a 14% target share (13th). In seven of his games he finished as a top-12 tight end. In the other eight games, he finished outside the top-18.",88.89,114.3,11,19,13.1,92,180,121.3,5.3,36,64,50.8,6,
116,,,RB42,RB,RB,42,9,James Robinson,HABANEROS,$4 ,PP,JAC,11,"James Robinson operated as the pseudo bellcow for the Jacksonville Jaguars in 2021 after Travis Etienne went down with a preseason injury. He posted inconsistent fantasy production as the RB24 overall and in points per game in 14 games amid horrible usage deployed by the 2021 Jags coaching staff. His touches varied from 21-to-2 depending on the week, so he was nearly impossible to project in fantasy. It's possible that 2022 presents a similar issue with Robinson as Etienne makes his professional debut. But JRob does deserve credit for maintaining efficient play whenever he got opportunities last season, finishing 11th in yards after contact per attempt (3.3) and 8th in red-zone touchdowns (8). His real hurdle for fantasy relevance besides fending off a 2022 first-round running back is attempting a speedy recovery from a torn Achilles suffered in late December. He was unable to participate in OTAs, while his backfield counterpart is full-go as the team installs the new-look Doug Pederson offense. The former undrafted free agent is not guaranteed to be ready for Week 1. Although he did avoid being placed on the PUP list, which is encouraging for his short-term availability. It's hard to envision Robinson being anything more than a speculative zero-RB target, with hopes that he can recapture 2020 form if given the volume. However, Pederson's track record of deploying a multitude of backs does make it seem like Robinson will be a 1B to Etienne's 1A, with his clearest path to fantasy relevance coming through goal-line opportunities.",128.72,142.9,38,53,42.5,96,156,122.4,2.3,12,21,16.4,1.9,
117,,,WR47,WR,WR,47,9,Treylon Burks,ROOKIE,NA,,TEN,6,"Treylon Burks finished first in his class in yards per route run (3.57) while also ranking No. 1 in yards per route run when lined up outside (6.08) among all receivers. It's an encouraging sign that a size-speed specimen delivered when aligned on the perimeter, as he spent 77% of his career in the slot. The rookie's 8.5 yards after the catch rank 14th among 169 qualifying wide receivers (92nd percentile) over the past two seasons.His elite college production and top-notch 32% dominator rating speak for themselves. And the best part is, he should produce from Day 1 after being drafted by the Tennessee Titans in the 1st round of the NFL Draft. There's hardly any competition for targets outside of Robert Woods), who is coming off a torn ACL. And with a similar YAC-ability to A.J. Brown, Burks should be able to step on the field on day one and offer immediate fantasy football appeal as a top-30 fantasy option.",114.15,0,38,69,51.4,86,189,122.6,10.6,35,49,42,3.2,
118,,,QB16,QB,QB,16,9,Justin Fields,PROGRAM,$1 ,X,CHI,14,"Fields looked completely overmatched early in his rookie season but showed promise as the season wore on. He ran for 361 yards over his final seven starts, hinting at vast rushing potential. He's a work in progress as a passer, but he has a big arm and is capable of making all the throws. Alas, the Bears aren't making much of an effort to provide him with adequate pass-catching weaponry.",252.06,136.8,14,22,17.4,105,150,123.6,,8,18,13.4,2.1,
119,,,QB17,QB,QB,17,9,Tua Tagovailoa,INVINCIBLES,$1 ,X,MIA,11,"Tua's 2021 season revealed him to be more of a game manager than a playmaker. The average depth of his throws was 7 yards, and he looked more comfortable throwing underneath than downfield. Tua topped 300 yards just once in 12 games and threw for fewer than 200 yards in 4 of his last 8 starts. The addition of WR Tyreek helps, but can Tua take full advantage of Hill's speed? Tua's rushing contributions are more window dressing than needle-moving.",292.89,190.9,15,22,17,116,162,124.8,4.3,37,62,50.3,5.5,
120,,,QB18,QB,QB,18,9,Trevor Lawrence,WAILERS,$5 ,F,JAC,11,"Joe Burrow's massive second-year jump is encouraging for this year's second-year QBs like Trevor Lawrence. The Jags quarterback finished with the same expected fantasy points per game average as Burrow in 2021 (17.3) but underwhelmed tremendously in a poor situation. His -72.3 fantasy points versus expectation were the most of any QB in 2021. Lawrence posted a season-high 85.1 PFF passing grade in the season-finale, offering some hope that he can turn things around in 2022 with a new coaching staff in place. There's a strong chance that Jacksonville dials up the passing attempts with Doug Pederson calling the shots on offense. During his five-year tenure in Philadelphia, only once did the offense not finish top-10 in pass attempts.",304.34,216,15,23,18.4,117,156,128,3.4,30,47,43.3,3.6,
121,,,WR48,WR,WR,48,9,Tyler Boyd,FREE AGENT,NA,,CIN,10,"Tyler Boyd was a victim of circumstances more than anything else in 2021, with two alpha wide receivers in the Bengals offense leaving him nothing but scraps. The Bengals slot receiver commanded just a 15% target share and target rate per route run. The target rate per route ranked dead-last among 73 qualifying players last season that commanded at least 100 targets. It's clear that Boyd can't be viewed as much working as a clear ancillary piece of the Cincinnati passing attack. Tight end C.J. Uzomah's departure does open up the potential that Boyd could shoulder a larger target workload, but his upside remains extremely limited while Ja'Marr Chase and Tee Higgins are healthy.",106.23,116.8,43,59,50.6,101,157,128.9,2.3,13,22,16.8,2,
122,,,WR49,WR,WR,49,9,Marquez Valdes-Scantling,SHAFT,$1 ,X,KC,8,"Just less than a day after trading Tyreek Hill to the Miami Dolphins, the Chiefs have signed his replacement Marquez Valdes-Scantling. It's a three-year deal worth up to $36 million. Essentially the same money that Russell Gage got from the Buccaneers and what Zay Jones got from Jacksonville. The ex-Packers field stretcher has ranked inside the top-5 in yards per reception over the last two seasons, so he will feel right at home catching bombs from Patrick Mahomes. He is sure to experience spiked weeks of production attached to the Chiefs' big-armed quarterback, but valuing him more than a weekly boom-or-bust fantasy WR3/4 would be malpractice. MVS does get a bump up in the WR rankings with a slight upgrade at QB and the opportunity to see a larger target share, but I wouldn't view him too dissimilarly to how he was perceived in Green Bay for the past four seasons. He has never commanded 75 targets in a season. His 2022 wide receiver ranking is comfortably behind JuJu Smith-Schuster and Skyy Moore.",111.64,61,41,64,52.6,99,160,129.4,2.8,11,21,14.8,2.2,
123,,11,RB43,RB,RB,43,9,Kenneth Gainwell,HOMIES,$6 ,X,PHI,7,"Kenneth Gainwell was in the backfield mix all season long, but he wasn't given a prominent role. The most we saw of Gainwell was 53% of the snaps played in Week 18, where he turned his 16 touches into 87 total yards. With Jordan Howard not returning, he's in the running with Boston Scott and Kennedy Brooks to mix in behind Miles Sanders. Gainwell was sixth in yards per route run last season, which isn't shocking considering his receiving chops coming out of Memphis. His ability as a pass-catcher could be his easiest path to earning more playing time this season.",121.17,90.4,41,58,46.5,98,170,131.4,3.1,35,49,43.5,2.9,
124,,,TE14,TE,TE,14,9,Irv Smith Jr.,FREE AGENT,NA,,MIN,7,"Assuming Irv Smith is at full health to start the season, he could compete with Adam Thielen as the second target in Minnesota behind Justin Jefferson. Let's not forget that Smith was eighth in yards per target and second in QBR when targeted among tight ends in 2020. The Vikings surprised everyone by ranking 12th in neutral passing rate and eighth in neutral pace last year. If that repeats, the volume will be there for Smith. As an unrestricted free agent in 2023, Smith should be heavily motivated to post career-best numbers.",89.27,0,11,22,15.5,106,167,131.8,3.5,38,52,43.3,3.6,
125,,,RB44,RB,RB,44,9,Alexander Mattison,WAILERS,$4 ,X,MIN,7,"Alexander Mattison has played out of his mind when given the opportunity with Dalvin Cook sidelined. In the four games since 2020 with 60% or higher snap counts, he's averaged 23.5 rushing attempts with 148.2 total yards per game. In that quartet of games, he was the RB7, RB6, RB8, and RB4 in weekly scoring. Assuming Kevin O'Connell doesn't upset the order of things or Ty Chandler or Kene Nwangwu don't hop him on the depth chart, Mattison is primed to remain one of the top handcuff options in fantasy.",91.13,93.9,40,55,45.2,119,170,132.7,1.7,11,25,14.8,3.1,
126,,,WR50,WR,WR,50,9,Garrett Wilson,ROOKIE,NA,,NYJ,10,"After enjoying a breakout sophomore campaign in 2020 that saw Garrett Wilson earn a 34% dominator rating - which considers the number of touchdowns and receiving yards a player commands within their offense - at 20 years old, the Ohio State product ran it back in impressive fashion in 2021. The Buckeye scored 12 receiving touchdowns, compiled over 1,000 receiving yards and generated the FBS' 12th-highest passer rating when targeted (141.7). He also proved to NFL teams that he was more than just a shifty slot receiver, averaging 3.00 yards per route run despite operating on the outside on 83% of his routes run, which nearly matched his same yards per route run average from 2020 when he spent most of his time inside. And although Wilson's 2021 24% dominator rating was less than his sophomore campaign, that's really due to Ohio State's talent in the wide receiver room. He was competing for targets with senior Chris Olave and sophomore standout Jaxon Smith-Njigba, who led the nation in PFF receiving grade (91.7). Going beyond the box score reveals that Wilson is a versatile route runner who can align anywhere on the field and still win. He was selected by the New York Jets 10th overall and joins a somewhat crowded WR room. And nobody can be sure Zach Wilson can support one or multiple fantasy assets. There are definitely question marks. However, Wilson is worth betting on because he's shown the ability at Ohio State to command targets and produce in an offense littered with other elite talents. Doesn't hurt his chance that he was deemed open on 84% of his targets last season.",108.12,0,45,72,54.9,107,206,133.6,7.7,38,78,50.4,8.2,
127,,,TE15,TE,TE,15,9,David Njoku,SHAFT,$3 ,X,CLE,9,"Franchise-tagged tight end David Njoku has a golden opportunity to break out in 2022 with Deshaun Watson and Jacoby Brissett as his quarterbacks after an encouraging 2021. He set career highs in PFF grade (70.9, 10th), yards per route run (1.56, 8th), and yards after the catch per reception (7.0, first) among tight ends that commanded at least 50 targets in 2021. The Browns also released Austin Hooper, which should open up the opportunity for the athletic Njoku to take a major leap. Don't be too quick to forget that Njoku already as a top-10 TE finish on his career resume. And with Brissett under center for the first six weeks, I wouldn't be surprised to see Njoku lead this team in targets. Former Colts tight end Jack Doyle led the Colts in targets/receptions in the seasons started by Brissett a few years ago, which suggests that Njoku could be a prime buy-low target. The Browns offense ranks top-three in target share to TEs over the past two seasons under head coach Stefanski.",92.96,71.6,10,22,16,94,172,133.8,11.1,50,71,56.2,5.8,
128,,,WR51,WR,WR,51,9,George Pickens,ROOKIE,NA,,PIT,9,"The Steelers selected George Pickens at pick No. 52 in the 2022 NFL Draft, with WR3 an area of need and Diontae Johnson (slated for free agency in 2023. I absolutely love the fit for Pickens here with the Steelers, who seem to never miss selecting wideouts on Day 2. Injuries and off-field issues plagued Pickens' draft stock, but he looks fully healthy based on his testing at the NFL Combine. And Pittsburgh seems like the right spot for him to get his head on straight. I already can't wait for the heated training camp fights between him and Chase Claypool as the gloves come off - well not really - for target supremacy. Pickens' college profile screams that of a true alpha, so I'd be looking to stash him across the board before he is fully unleashed. The Georgia Bulldog WR broke out as a true 18-year old freshman, finishing 2019 as PFF's the 17th-highest-graded receiver in the nation (88.0) - ahead of future NFL wideouts like Jerry Jeudy, Justin Jefferson, Devonta Smith and Jaylen Waddle.",113.23,0,41,63,51,96,223,134.1,2.9,10,23,15.6,3.1,
129,,,WR52,WR,WR,52,9,Russell Gage,SHAFT,$6 ,X,TB,11,"With the arrival of Julio Jones, the runway for Russell Gage isn't as clear as it once was. Chris Godwin's health reports returning with positive marks also muddies the water even more. Gage is a talented player who has the talent to take on a major role in this offense, but it's impossible to predict that now outside of Godwin missing time or a Julio Jones injury. Last year Gage was 17th in yards per route run (minimum 50 targets, per PFF) and 12th in route win rate (per Playerprofiler.com). With his target share in limbo, Gage has gone from a WR2/WR3 candidate to a WR4 with possibly huge upside.",106.56,97,43,71,53.9,101,212,136,2.7,16,26,19.9,2.7,
130,,,WR53,WR,WR,53,9,Skyy Moore,ROOKIE,NA,,KC,8,"Western Michigan WR Skyy Moore is being undervalued versus other Round 1 rookie WRs because he was a second-round pick as the 13th wide receiver selected in the draft. But Moore has a chance to hit the ground running in the post-Tyreek Hill era, competing for targets with fellow newcomers Juju Smith Schuster and Marquez Valdes-Scantling. His impressive YAC ability - tied for first with 26 forced missed tackles in 2021 - and ability to play both inside/outside helps him stand out from the other Chiefs WRs. With Patrick Mahomes as his quarterback, Moore could smash his current ECR into the stratosphere. It's not that outlandish to think a second-rounder can make an immediate impact considering six of the 12 highest-scoring Round 1 & 2 rookie WRs selected since 2017 were second-rounders.",103.03,0,45,67,55.1,96,208,138.1,5.8,33,79,53.7,9,
131,,12,RB45,RB,RB,45,9,Khalil Herbert,HOMIES,$11 ,X,CHI,14,"Khalil Herbert should enter camp with a leg up on the competition to be David Montgomery's backup. Last year in four games as the lead back when Montgomery was down, he was the RB40, RB11, RB6, and RB33 in fantasy. Among backs with 100 or more rushing attempts, he was 25th in yards after contact per attempt, ranking immediately ahead of Antonio Gibson. With a new regime at the helm, Herbert could be the guy if Montgomery misses any time, but don't rule out Darrynton Evans or Trestan Ebner getting involved.",80.21,64.9,42,54,47.8,118,182,138.1,2.6,12,21,18,2.2,
132,,,WR54,WR,WR,54,9,DeVante Parker,DYNASTY,$1 ,X,NE,10,"2021 was a typical season for DeVante Parker. The former first-round pick had at least seven targets in seven of his nine game played, scoring double-digit fantasy points in more than half of them. He averaged 12.9 expected fantasy points per game through 17 weeks (28th). His acquisition by the Patriots helps shore up the need for a big-bodied wide receiver on the perimeter that can make plays downfield. But the extent of how high a target share Parker will command remains to be seen. If anything, he probably has the most touchdown upside of the New England Patriots WRs. Just don't be overly bullish on him being available all season-long, as his injury history proceeds him. His 1.48 yards per route run was also his worst mark since 2018 as was his 55% catch rate.",113.85,63.5,44,68,55.2,107,174,139.7,2.1,13,25,18.2,2.6,
133,,13,WR55,WR,WR,55,9,Jakobi Meyers,HOMIES,$3 ,X,NE,10,"Jakobi Meyers is easily the most slept on wide receiver in fantasy football. The former undrafted free agent has been the Patriots target leader for the past two seasons, with his most recent accomplishment finishing top-12 in target share (23%) in 2021. The high-end target share also aligned with Meyer's deployment in the Patriots passing attack, where Meyers was running a route on 92% of team dropbacks - the sixth-highest mark in the league. New England's No. 1 receiver just needs to cash-in on more touchdowns to unlock his fantasy ceiling. He has been extremely underused in that category; his 866 receiving yards resulting in two touchdowns were the lowest of any WR in 2021.",107.72,103.3,45,63,55.4,111,180,141.6,5.1,36,70,53.1,6.8,
134,,,RB46,RB,RB,46,9,Nyheim Hines,HABANEROS,$4 ,X,IND,14,"Nyheim Hines posted career-lows across the receiving board in 2021, but there's hope that with a new quarterback under center that he can bounce back in 2022. No passer targeted running backs more than new Colts quarterback Matt Ryan did in 2021 - 8.6 targets per game. Bodes well for Hines to provide more usable weeks like he did in 2020. That year, Hines finished as RB18 in PPR scoring.",101.35,72.6,45,56,49,104,181,142.6,4.4,47,78,57.1,6.6,
135,,,TE16,TE,TE,16,9,Mike Gesicki,DYNASTY,$6 ,X,MIA,11,"Mike Gesicki may see his target numbers dip in 2022 in a run-heavy offense alongside target magnets Jaylen Waddle and Tyreek Hill. That will make his 2021 production difficult to replicate. The tight end/slot receiver hybrid finished sixth in receptions, ninth in receiving yards, fourth in route participation (78%), and fifth in target share (17%) through 18 weeks of action of the 2021 season. This receiving and route volume led to only moderate success in fantasy football, as Mike Gesicki finished as TE9. His efficiency metrics left something to be desired, though - he was 13th in fantasy points per game (9.9) and 15th in yards per route run. Part of that does fall on the up-and-down quarterback play, but it just further cements Gesicki as a good, not great tight end in fantasy football. My biggest concern is that Gesicki has almost always underwhelmed after the catch - which will likely be a large part of the Dolphins new-look offense. His 3.2 YAC/reception ranked 41st of out 42 qualifying tight ends. Gesicki did deliver worthwhile fantasy production at times, as displayed by his TE6 standing from Weeks 3-15 (11.5 fantasy points per game). And 94% of his snaps came lined up in the slot or out wide in 2021, which is another advantage for creating mismatches. But all in all, he tends to only rise to the occasion for fantasy purposes when targets become available in the offense because of injuries to other players. The athletic tight end will end up meeting his mid-range 2022 ADP/ECR based on his consistent play the past two seasons, but won't enter the top-tier fantasy tight end conversation.",104.41,92,10,24,16.9,108,236,142.6,3.1,44,59,48.6,2.5,
136,,,RB47,RB,RB,47,9,Tyler Allgeier,ROOKIE,NA,,ATL,14,"Tyler Allgeier has been tossed into a backfield with aging and unimpressive parts, where he could ultimately take over the lead role. Allgeier closed out his career at BYU with a pummeling 275 carry season that he turned into 1,611 rushing yards. Allgeier shined with 4.16 yards after contact, ranking tenth among all FBS running backs with 100 or more carries last season (per PFF). Sadly he bombed his athletic testing and fell in the draft before Atlanta scooped him up. Atlanta may lean on this young volume rusher, but it's also conceivable that Patterson and Damien Williams eat into the rushing pie enough to render Allgeier an afterthought.",120.55,0,43,75,50.8,115,237,145.9,5.5,40,58,48.6,4.6,
137,,,RB48,RB,RB,48,9,Jamaal Williams,DYNASTY,$5 ,C,DET,6,"Last season in the early going, Jamaal Williams was the understudy to D'Andre Swift, which is a role he will reprise this season. In Weeks 1-7, he averaged 12.4 touches and 58.7 total yards per game playing 29-49% of snaps per game. He was the RB37 in fantasy points per game. When Swift was out and Williams was active, he played 42-47% of snaps with 18 rushing attempts and 74 rushing yards per game. Williams isn't the sexiest handcuff or late-round selection, but the Lions' offense should take another step forward this year, and Williams will be the primary back if Swift were to miss time again.",97.92,93.8,43,57,47.8,126,192,146.4,4.2,38,56,47.6,3.9,
138,,,RB49,RB,RB,49,9,Brian Robinson Jr.,ROOKIE,NA,,WAS,14,"The dependable 6'2” 224 lb Brian Robinson lands in Washington via the third round of the NFL Draft. Robinson bided his time behind a plethora of talented backs at Alabama before finally taking over in 2021 as the lead guy. He responded by ranking fourth in missed tackles and eighth in ten plus yard runs last year (per PFF). Robinson might not wow people, but he's s battle-tested and sure-handed depth piece who can take over if Antonio Gibson gets hurt or continues to fumble away opportunities.",80.72,0,41,85,63.3,84,326,135.9,3.4,15,28,19.6,3.5,
139,,,WR56,WR,WR,56,9,Julio Jones,FREE AGENT,NA,,TB,11,"Julio Jones might not be the same player he was during his prime, but he's definitely not washed up. Last year Jones ranked 25th out of 90 wide receivers (minimum 50 targets, per PFF) in yards per route run (1.84). For added context, this was immediately ahead of Stefon Diggs and Diontae Johnson. Yes, this was also his career's lowest yards per route run, but even a watered-down version of Jones isn't a scrub. Now add that he's being air-dropped into one of the league's fastest, most pass-happy, and highest scoring offenses, and Jones becomes a magical upside ticket depending on where the market settles on him.",98.4,49.4,44,76,55.3,102,203,148.1,3.9,15,24,19.3,2.6,
140,,,WR57,WR,WR,57,9,DJ Chark Jr.,FREE AGENT,NA,,DET,6,"D.J. Chark is likely a better NFL signing than an addition to your fantasy squad. Chark has eclipsed 1.50 yards per route run in only one season (2019), so expecting him to enter this target tree and contend for the top option is asking a lot. His ability to stretch the field is real, as he's finished with a 119.4 or higher passer rating on deep throws in two of the last three seasons. If the Lions sustain injuries to their depth chart, Chark has shown the ability to lead a passing attack, but outside of that scenario, he's best viewed as a matchup flex play.",92.96,27.4,47,68,55.4,109,194,148.9,3.3,13,29,20.6,3.8,
141,,,QB19,QB,QB,19,9,Jameis Winston,FREE AGENT,NA,,NO,14,"Last year the Saints put the handcuffs on YOLO Jameis Winston. They ran a slow as molasses offense, relying on their run game and limiting Winston to 25.2 pass attempts and 185.7 passing yards per game. This could easily be the case again in 2022, but there are some reasons for optimism here. Winston will be entering his third season of this offensive scheme, so he should know it inside and out by now. Hopefully, the Saints get Michael Thomas back healthy to pair with newly drafted Chris Olave. This moves Marquez Callaway into a more reasonable WR3 role. This cast of weapons with Alvin Kamara also on board could lead to more passing attempts that we didn't see in 2021.",301.7,120.4,17,24,19.9,118,167,149.3,4.1,18,27,21.6,2.6,
142,,,WR58,WR,WR,58,10,Michael Gallup,ROID RAGERS,$1 ,C,DAL,9,"Michael Gallup is questionable to start the season at full strength. With the PUP looming over his head, the team could treat him carefully in the early going, especially after addressing the receiver position with the addition of Jalen Tolbert. Gallup has been a run-of-the-mill receiver in three of his four NFL seasons, with yards per route run totals ranging between 1.32-1.37 outside of his breakout 2019 season (per PFF). Gallup is a risky WR4/WR5 type.",105.54,56.5,45,73,59.2,99,206,150.7,4.1,51,71,58.3,5.6,
